{
  "$schema": "../schemas/archive-index.schema.json",
  "schemaVersion": "1.0",
  "generatedAt": "2026-04-04T00:47:23Z",
  "totalMixes": 3,
  "items": [
    {
      "id": "mix-036-thirtysixth",
      "slug": "mix-036-thirtysixth",
      "title": "Monday Music Mix #36",
      "displayTitle": "Thirtysixth",
      "publishedAt": "2013-11-19T05:09:00Z",
      "summary": "Also known as the Tuesday music mix. One week and one day later than originally should’ve been out in the wild. Some new, some old and reimagined.",
      "trackCount": 14,
      "favoriteCount": 3,
      "path": "data/published/mix-036-thirtysixth.json",
      "tags": []
    },
    {
      "id": "mix-035-thirtyfifth",
      "slug": "mix-035-thirtyfifth",
      "title": "Monday Music Mix #35",
      "displayTitle": "Thirtyfifth",
      "publishedAt": "2013-09-23T17:32:30Z",
      "summary": "A bit late given this is going up in the last hour of Monday but it still counts, right? Right. Left out a lot of really great music off this mix. Maybe someday I should do a Monday Music Mix: Rejects edition. Soon.",
      "trackCount": 15,
      "favoriteCount": 3,
      "path": "data/published/mix-035-thirtyfifth.json",
      "tags": []
    },
    {
      "id": "mix-034-thirtyfourth",
      "slug": "mix-034-thirtyfourth",
      "title": "Monday Music Mix #34",
      "displayTitle": "Thirtyfourth",
      "publishedAt": "2013-08-12T12:42:00Z",
      "summary": "New week, new mix. A little birdy from the mountains had to prod me to post this today.",
      "trackCount": 15,
      "favoriteCount": 4,
      "path": "data/published/mix-034-thirtyfourth.json",
      "tags": []
    }
  ]
}
